{
  "name": "markitdown-mcp",
  "description": "Microsoft's MCP server that converts files and office documents (PDF, Word, Excel, PowerPoint, images, audio, HTML, ZIP, YouTube URLs, EPUB) into Markdown inside any MCP-compliant agent.",
  "source_url": "https://github.com/microsoft/markitdown",
  "contents": {
    "skills": []
  },
  "vendor": "Microsoft",
  "license": "MIT",
  "version": "0.0.1",
  "category": "meta",
  "mcp": "uvx markitdown-mcp"
}
